Shree Ram Hardware & Sanita..,+(91)-7567493500,4.3,9,"Rajmandir Complex, Kuwadva Road, Greenland Chowk, Rajkot - 360003, Near Sadguru Ashram",
Chetan Hardware Stores,07947257770,4.5,318,"Canal Main Road, Canal Road, Rajkot - 360002, Near Dena Bank",
Wood Leaf Interiors,07947258649,5.0,1,"Opposite maruti suzuki showroom, Tagore Road, Rajkot - 360002",
Uttam Hardware,+(91)-9377845145,4.5,20,"Shop No G-1 Krishna Complex-3, Nana Mava Main Road, Rajkot - 360005, Near Rajnagar Chowk",
Chamunda Ply And Hardware,07947077311,5.0,1,"Near Raj Bank, Shaktni Nagar, Mavdi Main Road, Rajkot - 360004",
Hardware Khazana,+(91)-0281-2463999,4.4,446,"Shop No 30 to 32 Rajratna Complex, Tagore Road, Rajkot - 360002, Near Atul Motors Pvt Ltd",
Santoshi Wooden Furniture,07947259234,5.0,1,"Real Prime shop no. 124, Mavdi Main Road, Rajkot - 360004",
Redline Hardware Products,07947080925,4.8,19,"Bhojalram, 1-Ramnagar, Diamond Street, Kotharia, Rajkot - 360002, Near Kothariya Chokdi",
Vishweshwar Hardware & Plyw..,+(91)-9824735617,4.4,4,"Dwarkesh Apartment, Shop No 8, Ground Floor,, Nana Mava Main Road, Rajkot - 360005, Near Sastri Nagar Telephone Exchange,",
Aricon Studio LLP,+(91)-8866775599,4.7,20,"Beside Vraj Hospital, Opposite Bank Of Baroda, 150 Feet Ring Road, Rajkot - 360005, Near Balaji Hall",
Bajrang Enterprise,+(91)-7817838180,5.0,5,"Mavdi By Pass Road, Khodiyar Industrial Area, Street No 1, Morbi Road, Rajkot - 360004, Opp.raghvirpan",
Ishaan Interior,+(91)-9825217177,4.0,4,"108, Nakshtra Heights, 150 Feet Ring Road, Rajkot - 360005, Opposite Raiya Telephone Exchange",
Shree Ganesh Traders,+(91)-281-2561416,5.0,6,"Sitaram Park, Kalawad Road, Mota Mava, Rajkot - 360005, Opposite Rangoli Restaurant",
Patel Steel & Cement,+(91)-0281-2561587,4.1,5,"Patel Trade Centre Galexy, Park-2 Nr Rangoli Park, Kalavad Road, Rajkot - 360005, Near Kalawad Main Road Mota Mahuva",
Shiv Traders,+(91)-9925290980,4.0,1,"Tulsi Park 3, Nana Mava, Rajkot - 360005, Nr Patel Pendawala",
Radix Enterprise,+(91)-8000888867,0.0,0,"JK Green Indstri Area, Lothada GIDC, Rajkot - 360005, Near Mavdi",
Hardware Product Manufactur..,+(91)-9375654548,0.0,0,"Shiv Complax, Amrpali Road, Kalavad Road, Rajkot - 360005",
Raj Paint & Hardware,+(91)-0281-2478552,0.0,0,"Lp Park, Rajkot - 360005, Bes Chirag Auto",
Maruti Hardware & Sanitaryw..,+(91)-9426936113,0.0,0,"Rajkot - 360005, Kothariya",
Savla Engineering,+(91)-281-2783476,0.0,0,"Kalavad Road, Rajkot - 360005, Opp Motel The Village Haripar",
Darshan Hardware & Sanitary,+(91)-0281-2332392,4.1,8,"5, Angan Residency, Nana Mava Road, Nana Mava, Rajkot - 360005, Opposite Shashtrinagar Society",
Somnath Enterprise,+(91)-8690936998,4.6,7,"Jivraj Park Gate, Mota Mauva, Mota Mava, Rajkot - 360005, Near Speedwell Party Plot",
Shree Ram Hardware,+(91)-8000997272,4.6,4,"7/ Rani Tower, Near Cell Petrol Pump, Kalavad Road, Rajkot - 360005, Opposite Crystal Mall",
Ganesh Hardware,+(91)-9429560262,4.7,3,"Platinum Square, Shop No.4, Ambika Township, Nana Mava, Rajkot - 360005, B/H Kasturi Residency",
Shiv Shakti Steel Corporati..,+(91)-9726666636,2.6,3,"B/h Prem Mandir, Neel City Club Road, University Road, Rajkot - 360005, Opp AG Staff Quarters, Ruda 2 Society",
